{
  "$schema": "./schema/dsa.schema.json",
  "source": {
    "label": "LeetCode Salesforce company tag, all 193 problems",
    "url": "https://github.com/liquidslr/leetcode-company-wise-problems/tree/main/Salesforce",
    "note": "Salesforce-tagged problems only, grouped by pattern and sorted by how often Salesforce asks them (100 = most). Problems with a Solution button have a tested Python solution and notes; the rest link to LeetCode."
  },
  "dsa_patterns_site": "https://anuvik2401.github.io/DSA_Patterns/",
  "status_options": [
    {
      "id": "todo",
      "label": "Not solved"
    },
    {
      "id": "attempted",
      "label": "Attempted"
    },
    {
      "id": "review",
      "label": "Needs review"
    },
    {
      "id": "solved",
      "label": "Solved"
    }
  ],
  "timed": {
    "minutes": 45,
    "count": 2
  },
  "script": [
    {
      "step": "Clarify",
      "minutes": 3,
      "say": "Before I code, let me confirm the input sizes, value ranges, edge cases like empty input, and what to return when there is no answer."
    },
    {
      "step": "Brute force",
      "minutes": 2,
      "say": "The straightforward way is ... which is O(...). That works, but it is too slow at n = ..."
    },
    {
      "step": "Optimize",
      "minutes": 5,
      "say": "This looks like a ... problem because ... . If I ... , I can get to O(...). Does that sound good before I write it?"
    },
    {
      "step": "Code with narration",
      "minutes": 20,
      "say": "Narrate intent, not syntax: here I keep the window valid, here I record the answer. Name helpers for each step."
    },
    {
      "step": "Test",
      "minutes": 5,
      "say": "Walk the example by hand, then an edge case: empty, one element, all equal, the no-answer case."
    },
    {
      "step": "Final complexity",
      "minutes": 1,
      "say": "Time is O(...) because ... ; space is O(...) for ... . If I had more time I would ..."
    }
  ],
  "patterns": [
    {
      "id": "heaps",
      "name": "Heaps and scheduling",
      "signals": [
        "k largest or smallest",
        "next event in time order",
        "schedule tasks under limits",
        "merge sorted streams",
        "running median"
      ],
      "template": "import heapq\n\nheap = []\nheapq.heappush(heap, (priority, tiebreak, item))  # tiebreak avoids comparing items\nwhile heap:\n    priority, _, item = heapq.heappop(heap)\n    # process, push follow-ups\n\n# max-heap: push -value\n# top k largest: keep a min-heap of size k",
      "pitfalls": [
        "Python heapq is a min-heap; negate for max.",
        "Tuples compare element by element; add a counter tiebreak before objects.",
        "Event simulation: pop every event at the same timestamp before starting new work."
      ]
    },
    {
      "id": "bfs",
      "name": "BFS and graphs",
      "signals": [
        "shortest path in steps",
        "grid with moves",
        "spreading over time",
        "dependencies or ordering",
        "weighted shortest path (Dijkstra)"
      ],
      "template": "from collections import deque\n\ndist = {start: 0}\nqueue = deque([start])\nwhile queue:\n    node = queue.popleft()\n    for nxt in neighbors(node):\n        if nxt not in dist:\n            dist[nxt] = dist[node] + 1\n            queue.append(nxt)",
      "pitfalls": [
        "Mark visited when you enqueue, not when you pop, or nodes get queued twice.",
        "Level-by-level: loop range(len(queue)) to count minutes or layers.",
        "Weighted edges need Dijkstra, not BFS.",
        "Cycle detection in topological sort: processed count < n."
      ]
    },
    {
      "id": "sliding-window",
      "name": "Sliding window and two pointers",
      "signals": [
        "longest or shortest subarray or substring",
        "at most k distinct or k changes",
        "count subarrays with a property",
        "sorted array pair sums",
        "in-place compaction"
      ],
      "template": "left = 0\nfor right, x in enumerate(items):\n    add(x)\n    while window_invalid():\n        remove(items[left])\n        left += 1\n    best = max(best, right - left + 1)",
      "pitfalls": [
        "Shrinking only works when validity is monotonic (adding never fixes, removing never breaks).",
        "Counting subarrays: add right - left + 1 per step.",
        "Negative numbers break product and sum windows; reach for prefix sums."
      ]
    },
    {
      "id": "intervals",
      "name": "Intervals",
      "signals": [
        "meetings, bookings, ranges",
        "merge or insert ranges",
        "minimum rooms or resources",
        "cover a line with segments"
      ],
      "template": "intervals.sort()  # by start\nmerged = []\nfor start, end in intervals:\n    if merged and start <= merged[-1][1]:\n        merged[-1][1] = max(merged[-1][1], end)\n    else:\n        merged.append([start, end])",
      "pitfalls": [
        "Ask whether touching endpoints overlap.",
        "Sort by end for greedy keep-the-most problems, by start for merging.",
        "Rooms: heap of end times, or sweep over sorted starts and ends."
      ]
    },
    {
      "id": "hashing",
      "name": "Hashing and prefix sums",
      "signals": [
        "subarray sums to k",
        "group by a signature",
        "seen before or nearest equal",
        "count pairs with a difference"
      ],
      "template": "from collections import defaultdict\n\nseen = defaultdict(int)\nseen[0] = 1  # empty prefix\nprefix = count = 0\nfor x in nums:\n    prefix += x\n    count += seen[prefix - k]\n    seen[prefix] += 1",
      "pitfalls": [
        "Seed the empty prefix (seen[0] = 1).",
        "Count before you insert the current prefix.",
        "Tuple keys for signatures; lists are not hashable."
      ]
    },
    {
      "id": "binary-search",
      "name": "Binary search on the answer",
      "signals": [
        "minimize the maximum or maximize the minimum",
        "smallest speed, capacity, or size that works",
        "a feasibility check that is monotonic"
      ],
      "template": "lo, hi = smallest_possible, largest_possible\nwhile lo < hi:\n    mid = (lo + hi) // 2\n    if feasible(mid):\n        hi = mid      # mid works, try smaller\n    else:\n        lo = mid + 1\nreturn lo",
      "pitfalls": [
        "Say why feasible() is monotonic before coding.",
        "Pick bounds that are definitely valid and invalid (max element, total sum).",
        "lo < hi with hi = mid never loops forever; lo <= hi variants do if you forget +1."
      ]
    },
    {
      "id": "dp",
      "name": "DP basics",
      "signals": [
        "count ways or minimum cost",
        "choices at each step with overlapping subproblems",
        "two strings compared character by character",
        "bit tricks with greedy proofs"
      ],
      "template": "# 1. state: what does dp[i] mean in words\n# 2. transition: dp[i] from smaller states\n# 3. base case, then iterate in dependency order\ndp = [base] + [INF] * n\nfor i in range(1, n + 1):\n    for choice in choices(i):\n        dp[i] = min(dp[i], dp[i - cost(choice)] + 1)",
      "pitfalls": [
        "Say the state in one sentence before writing code.",
        "Roll arrays to O(n) space only after it works.",
        "Greedy needs a proof or a brute-force check; say which."
      ]
    },
    {
      "id": "union-find",
      "name": "Union-find",
      "signals": [
        "connected components while edges arrive",
        "merge groups",
        "minimum spanning tree (Kruskal)",
        "is the graph connected"
      ],
      "template": "parent = list(range(n))\ndef find(x):\n    while parent[x] != x:\n        parent[x] = parent[parent[x]]  # path halving\n        x = parent[x]\n    return x\ndef union(a, b):\n    ra, rb = find(a), find(b)\n    if ra == rb:\n        return False\n    parent[ra] = rb\n    return True",
      "pitfalls": [
        "Track component count as you union.",
        "Per-component data lives at the root.",
        "Union-find does not support deletes; process offline or rebuild."
      ]
    },
    {
      "id": "design",
      "name": "Design data structures",
      "signals": [
        "implement a cache",
        "O(1) get and put",
        "frequency or recency ordering"
      ],
      "template": "from collections import OrderedDict\n\nitems = OrderedDict()\nitems.move_to_end(key)          # mark recent\nitems.popitem(last=False)       # evict oldest",
      "pitfalls": [
        "Interviewers may ban OrderedDict; know the hash map plus doubly linked list version.",
        "Updating an existing key also refreshes recency.",
        "Capacity 0 edge case."
      ]
    },
    {
      "id": "stack-greedy",
      "name": "Stacks and greedy",
      "signals": [
        "collisions or cancellations",
        "remove adjacent runs",
        "best choice with a counting argument",
        "settle debts or balances"
      ],
      "template": "stack = []\nfor x in items:\n    while stack and conflicts(stack[-1], x):\n        resolve(stack.pop(), x)\n    if still_alive(x):\n        stack.append(x)",
      "pitfalls": [
        "Write down which pairs interact before coding the loop.",
        "Store counts on the stack for run-length removals.",
        "Greedy: argue why the local choice is safe."
      ]
    },
    {
      "id": "trees",
      "name": "Trees",
      "signals": [
        "binary tree or BST",
        "paths, depths, or levels",
        "lowest common ancestor",
        "serialize or rebuild a tree"
      ],
      "template": "def dfs(node):\n    if not node:\n        return base\n    left = dfs(node.left)\n    right = dfs(node.right)\n    # combine children, update a global answer if needed\n    return combine(node, left, right)",
      "pitfalls": [
        "Decide what each call returns before coding.",
        "Path problems often return one value and track another globally.",
        "Level order needs BFS with range(len(queue))."
      ]